{
  "fixture": "dashboard",
  "clean": false,
  "provenance": "Seeded by construction on 2026-10-01 on a single Operate route. Text contrast (except the seeded labels), focus, targets, reflow and copy otherwise meet the floor, so other detections are false positives.",
  "defects": [
    {
      "id": "dashboard-D01",
      "criterion": "TYP-06",
      "kind": "deterministic",
      "route": "/",
      "state": "default",
      "selector": "h1, h2, h3",
      "file": "styles.css",
      "description": "Flat type hierarchy: the page title is 16 px, panel titles 15 px, chart title 14 px and body 14 px, with weights only 100 apart, so no role steps up by the 1.125 an Operate surface needs.",
      "expected_severity_band": [1, 2],
      "expected_check": "census",
      "seeded_from": "evaluation-plan"
    },
    {
      "id": "dashboard-D02",
      "criterion": "LAY-01",
      "kind": "deterministic",
      "route": "/",
      "state": "default",
      "selector": null,
      "file": "styles.css",
      "description": "Spacing is off any scale: paddings, margins and gaps of 6, 7, 9, 10, 13, 15, 18 and 22 px, none of them tokens.",
      "expected_severity_band": [1, 2],
      "expected_check": "census",
      "also_detected_by": ["lint"],
      "seeded_from": "evaluation-plan"
    },
    {
      "id": "dashboard-D03",
      "criterion": "SLP-07",
      "kind": "deterministic",
      "route": "/",
      "state": "default",
      "selector": ".panel .metric",
      "file": "styles.css",
      "description": "Card kit: each reading is a bordered, shadowed, rounded card inside a bordered, shadowed, rounded panel, and every card shares one shadow and one 20 px radius.",
      "expected_severity_band": [1, 2],
      "expected_check": "tells",
      "seeded_from": "evaluation-plan"
    },
    {
      "id": "dashboard-D04",
      "criterion": "SLP-23",
      "kind": "deterministic",
      "route": "/",
      "state": "default",
      "selector": ".panel, .metric",
      "file": "styles.css",
      "description": "One 20 px radius on every rounded element (panels, cards, chips, navigation pills, the switch) with no radius scale.",
      "expected_severity_band": [1, 1],
      "expected_check": "tells",
      "seeded_from": "evaluation-plan"
    },
    {
      "id": "dashboard-D05",
      "criterion": "TYP-14",
      "kind": "deterministic",
      "route": "/",
      "state": "default",
      "selector": ".metric__value",
      "file": "styles.css",
      "description": "Live readings that are compared and update in place (pH, conductivity, temperature, oxygen, reservoir) are set in Futura, whose default figures are proportional (a 1 is much narrower than a 0), and nothing sets font-variant-numeric: tabular-nums, so each value changes width as it updates. Futura ships with macOS; where it is missing, the fallback face may have equal-width digits and the defect does not render.",
      "expected_severity_band": [1, 1],
      "expected_check": "census",
      "seeded_from": "evaluation-plan"
    },
    {
      "id": "dashboard-D06",
      "criterion": "1.4.1",
      "also_criteria": ["A11Y-19", "1.3.1"],
      "kind": "judged",
      "route": "/",
      "state": "default",
      "selector": "#sensors .dot",
      "file": "index.html",
      "description": "Sensor status is shown only by a green, amber or red dot with no text, label or pattern; the dots are empty spans, so the status is lost to colour-blind growers and to screen readers alike.",
      "expected_severity_band": [2, 3],
      "expected_check": null,
      "seeded_from": "evaluation-plan"
    },
    {
      "id": "dashboard-D07",
      "criterion": "CMP-05",
      "kind": "judged",
      "route": "/",
      "state": "default",
      "selector": "#readings",
      "file": "dashboard.js",
      "description": "The readings, sensor table and pump events have no loading, empty or error state: nothing shows a stale feed, a disconnected probe or a failed load, and the page always renders the last values as if they were current.",
      "expected_severity_band": [2, 3],
      "expected_check": null,
      "seeded_from": "evaluation-plan"
    },
    {
      "id": "dashboard-D08",
      "criterion": "MOT-01",
      "kind": "deterministic",
      "route": "/",
      "state": "default",
      "selector": ".panel",
      "file": "styles.css",
      "description": "Panels declare transition: all 200ms, so any property change, including layout, animates.",
      "expected_severity_band": [1, 1],
      "expected_check": "motion",
      "also_detected_by": ["lint"],
      "seeded_from": "evaluation-plan"
    },
    {
      "id": "dashboard-D09",
      "criterion": "MOT-03",
      "kind": "deterministic",
      "route": "/",
      "state": "default",
      "selector": ".switch__knob",
      "file": "styles.css",
      "description": "The dosing switch knob moves on a bounce curve, cubic-bezier(0.68, -0.55, 0.27, 1.55), which overshoots on a plain state change.",
      "expected_severity_band": [1, 2],
      "expected_check": "motion",
      "also_detected_by": ["lint"],
      "seeded_from": "evaluation-plan"
    },
    {
      "id": "dashboard-D10",
      "criterion": "MOT-02",
      "kind": "deterministic",
      "route": "/",
      "state": "default",
      "selector": ".chip",
      "file": "styles.css",
      "description": "Status chips change colour over 600 ms, more than twice the 250 ms budget for state changes on an Operate surface.",
      "expected_severity_band": [1, 2],
      "expected_check": "motion",
      "seeded_from": "evaluation-plan"
    },
    {
      "id": "dashboard-D11",
      "criterion": "TYP-01",
      "kind": "deterministic",
      "route": "/",
      "state": "default",
      "selector": ".axis span",
      "file": "styles.css",
      "description": "The chart's time labels are 10 px, below the 12 px minimum.",
      "expected_severity_band": [1, 2],
      "expected_check": "census",
      "seeded_from": "added"
    },
    {
      "id": "dashboard-D12",
      "criterion": "COL-01",
      "kind": "deterministic",
      "route": "/",
      "state": "default",
      "selector": null,
      "file": "styles.css",
      "description": "Colour drift: only 2 of about 35 colour declarations use a token; the rest are literal hex values, several of them equal to the --ink token.",
      "expected_severity_band": [1, 1],
      "expected_check": "lint",
      "seeded_from": "added"
    },
    {
      "id": "dashboard-D13",
      "criterion": "SHP-02",
      "kind": "deterministic",
      "route": "/",
      "state": "default",
      "selector": ".panel, .metric",
      "file": "styles.css",
      "description": "Ghost cards: in-flow panels and cards pair a 1 px border with a 32 px blurred shadow.",
      "expected_severity_band": [1, 1],
      "expected_check": "census",
      "seeded_from": "added"
    },
    {
      "id": "dashboard-D14",
      "criterion": "LAY-04",
      "kind": "deterministic",
      "route": "/",
      "state": "default",
      "selector": ".chip",
      "file": "styles.css",
      "description": "Status chips are filled pills with 1 px by 3 px padding and a line height of 1, so their text touches the edges.",
      "expected_severity_band": [1, 1],
      "expected_check": "census",
      "seeded_from": "added"
    },
    {
      "id": "dashboard-D15",
      "criterion": "1.4.3",
      "also_criteria": ["A11Y-11"],
      "kind": "deterministic",
      "route": "/",
      "state": "default",
      "selector": ".metric__label, .updated",
      "file": "styles.css",
      "description": "Reading labels and the last-reading time are #9aa0a6 on white, about 2.6:1 for 14 px text.",
      "expected_severity_band": [2, 3],
      "expected_check": "contrast",
      "also_detected_by": ["axe"],
      "seeded_from": "added"
    }
  ]
}
